{
  "schema_version": 6,
  "authority": "machine_checked_publish_readiness",
  "generated_markdown": "docs/release/publish-readiness.md",
  "publication_strategy": "publication_prep_no_upload",
  "facade_crate": "causlane",
  "readiness_status": "pass",
  "note": "This artifact is a deterministic publication-prep report. It does not publish crates, reserve names, verify cargo tokens or turn network availability into a blocking repo gate.",
  "package": {
    "name": "causlane",
    "version": "0.0.1",
    "manifest_path": "crates/causlane/Cargo.toml",
    "package_root": "crates/causlane",
    "description": "Typed, auditable, replayable, consequence-aware action dispatch.",
    "license": "MIT OR Apache-2.0",
    "authors": [
      "Boot and Pencil <lobanov@bootandpencil.com>"
    ],
    "repository": "https://github.com/Boot-and-Pencil/causlane",
    "homepage": "https://github.com/Boot-and-Pencil/causlane",
    "documentation": "https://docs.rs/causlane",
    "keywords": [
      "dispatch",
      "audit",
      "replay",
      "formal-methods",
      "kernel"
    ],
    "categories": [
      "development-tools",
      "rust-patterns"
    ],
    "rust_version": "1.85"
  },
  "package_files": [
    ".cargo_vcs_info.json",
    "Cargo.lock",
    "Cargo.toml",
    "Cargo.toml.orig",
    "README.md",
    "benches/dispatch_baseline_bench_suite.rs",
    "fixtures/contracts/examples/release_promote.registry.yaml",
    "fixtures/contracts/scenarios/release_promote_success.scenario.yaml",
    "src/lib.rs",
    "tests/public_api.rs"
  ],
  "name_availability": {
    "crate": "causlane",
    "deterministic_gate": "not_run",
    "advisory_command": "tools/publish-readiness --online",
    "note": "Crates.io availability is intentionally advisory because it is network-dependent and can change at any time."
  },
  "repository_visibility": {
    "repository": "https://github.com/Boot-and-Pencil/causlane",
    "deterministic_gate": "not_run",
    "advisory_command": "tools/publish-readiness --online",
    "note": "Public repository resolution is intentionally advisory because it is network-dependent and can change at any time."
  },
  "workspace_publication": {
    "status": "pass",
    "dependency_tiers": [
      {
        "tier": 0,
        "packages": [
          "causlane-core"
        ]
      },
      {
        "tier": 1,
        "packages": [
          "causlane",
          "causlane-contracts",
          "causlane-runtime"
        ]
      },
      {
        "tier": 2,
        "packages": [
          "causlane-replay",
          "causlane-codegen"
        ]
      },
      {
        "tier": 3,
        "packages": [
          "causlane-cli"
        ]
      }
    ],
    "facade_dependency_closure": [
      "causlane-core"
    ],
    "facade_publish_sequence": [
      "causlane-core",
      "causlane"
    ],
    "full_publish_sequence": [
      "causlane-core",
      "causlane-contracts",
      "causlane-runtime",
      "causlane-replay",
      "causlane-codegen",
      "causlane",
      "causlane-cli"
    ],
    "cycle_packages": [],
    "packages": [
      {
        "name": "causlane",
        "version": "0.0.1",
        "manifest_path": "crates/causlane/Cargo.toml",
        "package_root": "crates/causlane",
        "package_files": [
          ".cargo_vcs_info.json",
          "Cargo.lock",
          "Cargo.toml",
          "Cargo.toml.orig",
          "README.md",
          "benches/dispatch_baseline_bench_suite.rs",
          "fixtures/contracts/examples/release_promote.registry.yaml",
          "fixtures/contracts/scenarios/release_promote_success.scenario.yaml",
          "src/lib.rs",
          "tests/public_api.rs"
        ],
        "normal_workspace_dependencies": [
          {
            "name": "causlane-core",
            "requirement": "^0.0.1",
            "path": "crates/causlane-core"
          }
        ]
      },
      {
        "name": "causlane-core",
        "version": "0.0.1",
        "manifest_path": "crates/causlane-core/Cargo.toml",
        "package_root": "crates/causlane-core",
        "package_files": [
          ".cargo_vcs_info.json",
          "Cargo.lock",
          "Cargo.toml",
          "Cargo.toml.orig",
          "README.md",
          "src/application/mod.rs",
          "src/application/ports.rs",
          "src/application/use_cases.rs",
          "src/contract.rs",
          "src/domain/action.rs",
          "src/domain/approval.rs",
          "src/domain/approval_stepup.rs",
          "src/domain/authz.rs",
          "src/domain/authz_policy.rs",
          "src/domain/capability.rs",
          "src/domain/constraint.rs",
          "src/domain/constraint_runtime.rs",
          "src/domain/constraint_spec.rs",
          "src/domain/constraint_update.rs",
          "src/domain/drain.rs",
          "src/domain/drain_protocol.rs",
          "src/domain/effect.rs",
          "src/domain/frontier.rs",
          "src/domain/graph_index.rs",
          "src/domain/hashing.rs",
          "src/domain/lane.rs",
          "src/domain/lifecycle.rs",
          "src/domain/mod.rs",
          "src/domain/overlay.rs",
          "src/domain/projection_authz.rs",
          "src/domain/protocol_history.rs",
          "src/domain/redaction.rs",
          "src/domain/redaction_policy.rs",
          "src/domain/routing.rs",
          "src/domain/tier.rs",
          "src/domain/tracing.rs",
          "src/domain/why_not_parallel.rs",
          "src/integration/tests.rs",
          "src/integration.rs",
          "src/kernel.rs",
          "src/lib.rs",
          "src/ports.rs",
          "src/prelude.rs",
          "src/protocol.rs",
          "src/testing.rs",
          "tests/proptest_protocol_properties.rs"
        ],
        "normal_workspace_dependencies": []
      },
      {
        "name": "causlane-contracts",
        "version": "0.0.1",
        "manifest_path": "crates/causlane-contracts/Cargo.toml",
        "package_root": "crates/causlane-contracts",
        "package_files": [
          ".cargo_vcs_info.json",
          "Cargo.lock",
          "Cargo.toml",
          "Cargo.toml.orig",
          "README.md",
          "fixtures/contracts/examples/release_promote.registry.yaml",
          "src/attestation.rs",
          "src/bundle.rs",
          "src/canonical.rs",
          "src/contract.rs",
          "src/examples.rs",
          "src/hmac.rs",
          "src/invariants.rs",
          "src/lib.rs",
          "src/plan_hash.rs",
          "src/plan_template_cache.rs",
          "src/registry.rs",
          "src/scenario_runtime.rs",
          "src/serde_numeric.rs",
          "src/sha256.rs",
          "src/template.rs",
          "src/tests.rs"
        ],
        "normal_workspace_dependencies": [
          {
            "name": "causlane-core",
            "requirement": "^0.0.1",
            "path": "crates/causlane-core"
          }
        ]
      },
      {
        "name": "causlane-replay",
        "version": "0.0.1",
        "manifest_path": "crates/causlane-replay/Cargo.toml",
        "package_root": "crates/causlane-replay",
        "package_files": [
          ".cargo_vcs_info.json",
          "Cargo.lock",
          "Cargo.toml",
          "Cargo.toml.orig",
          "README.md",
          "fixtures/contracts/examples/multi_action_reference.registry.yaml",
          "fixtures/contracts/examples/projection_readonly.registry.yaml",
          "fixtures/contracts/examples/release_promote.registry.yaml",
          "fixtures/contracts/examples/release_promote.trace.json",
          "fixtures/contracts/scenarios/approval_wrong_plan_invalid.scenario.yaml",
          "fixtures/contracts/scenarios/conflict_free_parallelism_success.scenario.yaml",
          "fixtures/contracts/scenarios/conflicting_leases_invalid.scenario.yaml",
          "fixtures/contracts/scenarios/drain_with_active_lease_invalid.scenario.yaml",
          "fixtures/contracts/scenarios/event_after_closed_invalid.scenario.yaml",
          "fixtures/contracts/scenarios/execution_without_barrier_invalid.scenario.yaml",
          "fixtures/contracts/scenarios/execution_without_capability_invalid.scenario.yaml",
          "fixtures/contracts/scenarios/missing_witness_invalid.scenario.yaml",
          "fixtures/contracts/scenarios/multi_action_reference.scenario.yaml",
          "fixtures/contracts/scenarios/projection_anchor_wrong_fact_invalid.scenario.yaml",
          "fixtures/contracts/scenarios/projection_success.scenario.yaml",
          "fixtures/contracts/scenarios/projection_without_anchor_invalid.scenario.yaml",
          "fixtures/contracts/scenarios/read_only_sidecar_success.scenario.yaml",
          "fixtures/contracts/scenarios/release_promote_success.scenario.yaml",
          "fixtures/contracts/scenarios/witness_event_wrong_fact_kind_invalid.scenario.yaml",
          "fixtures/contracts/scenarios/witness_wrong_scope_invalid.scenario.yaml",
          "src/authz.rs",
          "src/contract.rs",
          "src/error.rs",
          "src/explain.rs",
          "src/lib.rs",
          "src/lifecycle.rs",
          "src/outcome.rs",
          "src/tests/attestation.rs",
          "src/tests.rs",
          "src/trace.rs",
          "src/trace_lowering.rs",
          "tests/conflict_free_parallelism.rs",
          "tests/error_diagnostics.rs",
          "tests/explain.rs",
          "tests/multi_action_reference.rs",
          "tests/mutation_fuzz.rs",
          "tests/projection_read_sidecar.rs",
          "tests/proptest_parse_boundaries.rs"
        ],
        "normal_workspace_dependencies": [
          {
            "name": "causlane-contracts",
            "requirement": "^0.0.1",
            "path": "crates/causlane-contracts"
          },
          {
            "name": "causlane-core",
            "requirement": "^0.0.1",
            "path": "crates/causlane-core"
          }
        ]
      },
      {
        "name": "causlane-runtime",
        "version": "0.0.1",